{
  "$schema": "https://json-schema.org/draft/2020-12/schema",
  "$id": "https://raw.githubusercontent.com/khaledaltheeb/rawafid-arabic-rtl-a11y-toolkit/main/schemas/research-assets.schema.json",
  "title": "Rawafid research asset catalog",
  "type": "object",
  "additionalProperties": false,
  "required": ["schemaVersion", "project", "reviewedAt", "assets"],
  "properties": {
    "$schema": { "type": "string" },
    "schemaVersion": { "const": 1 },
    "project": { "type": "string", "minLength": 1 },
    "reviewedAt": { "type": "string", "format": "date" },
    "assets": {
      "type": "array",
      "minItems": 1,
      "items": {
        "type": "object",
        "additionalProperties": false,
        "required": ["id", "title", "path", "type", "domains", "evidence", "documentation", "nonClaim"],
        "properties": {
          "id": { "type": "string", "pattern": "^[a-z0-9-]+$" },
          "title": { "type": "string", "minLength": 1 },
          "path": { "type": "string", "minLength": 1 },
          "type": { "enum": ["research-corpus", "evidence-manifest", "machine-contract"] },
          "domains": { "type": "array", "minItems": 1, "uniqueItems": true, "items": { "type": "string", "minLength": 1 } },
          "evidence": { "type": "array", "minItems": 1, "uniqueItems": true, "items": { "type": "string", "minLength": 1 } },
          "documentation": { "type": "string", "minLength": 1 },
          "nonClaim": { "type": "string", "minLength": 1 }
        }
      }
    }
  }
}
